"ch_version","name","value","changed","description","min","max","readonly","type","is_obsolete"
"24.3.12.76.altinitystable","zero_copy_concurrent_part_removal_max_postpone_ratio","0.05",0,"Max percentage of top level parts to postpone removal in order to get smaller independent ranges (highly not recommended to change)",\N,\N,0,"Float",0
"24.3.12.76.altinitystable","storage_policy","default",0,"Name of storage disk policy",\N,\N,0,"String",0
"24.3.12.76.altinitystable","disk","",0,"Name of storage disk. Can be specified instead of storage policy.",\N,\N,0,"String",0
"24.3.12.76.altinitystable","allow_nullable_key","0",0,"Allow Nullable types as primary keys.",\N,\N,0,"Bool",0
"24.3.12.76.altinitystable","remove_empty_parts","1",0,"Remove empty parts after they were pruned by TTL, mutation, or collapsing merge algorithm.",\N,\N,0,"Bool",0
"24.3.12.76.altinitystable","assign_part_uuids","0",0,"Generate UUIDs for parts. Before enabling check that all replicas support new format.",\N,\N,0,"Bool",0
"24.3.12.76.altinitystable","max_partitions_to_read","-1",0,"Limit the max number of partitions that can be accessed in one query. <= 0 means unlimited. This setting is the default that can be overridden by the query-level setting with the same name.",\N,\N,0,"Int64",0
"24.3.12.76.altinitystable","max_concurrent_queries","0",0,"Max number of concurrently executed queries related to the MergeTree table (0 - disabled). Queries will still be limited by other max_concurrent_queries settings.",\N,\N,0,"UInt64",0
"24.3.12.76.altinitystable","min_marks_to_honor_max_concurrent_queries","0",0,"Minimal number of marks to honor the MergeTree-level's max_concurrent_queries (0 - disabled). Queries will still be limited by other max_concurrent_queries settings.",\N,\N,0,"UInt64",0
"24.3.12.76.altinitystable","min_bytes_to_rebalance_partition_over_jbod","0",0,"Minimal amount of bytes to enable part rebalance over JBOD array (0 - disabled).",\N,\N,0,"UInt64",0
"24.3.12.76.altinitystable","check_sample_column_is_correct","1",0,"Check columns or columns by hash for sampling are unsigned integer.",\N,\N,0,"Bool",0
"24.3.12.76.altinitystable","allow_vertical_merges_from_compact_to_wide_parts","1",0,"Allows vertical merges from compact to wide parts. This settings must have the same value on all replicas",\N,\N,0,"Bool",0
"24.3.12.76.altinitystable","enable_the_endpoint_id_with_zookeeper_name_prefix","0",0,"Enable the endpoint id with zookeeper name prefix for the replicated merge tree table",\N,\N,0,"Bool",0
"24.3.12.76.altinitystable","zero_copy_merge_mutation_min_parts_size_sleep_before_lock","1073741824",0,"If zero copy replication is enabled sleep random amount of time before trying to lock depending on parts size for merge or mutation",\N,\N,0,"UInt64",0
"24.3.12.76.altinitystable","allow_floating_point_partition_key","0",0,"Allow floating point as partition key",\N,\N,0,"Bool",0
"24.3.12.76.altinitystable","sleep_before_loading_outdated_parts_ms","0",0,"For testing. Do not change it.",\N,\N,0,"UInt64",0
"24.3.12.76.altinitystable","always_use_copy_instead_of_hardlinks","0",0,"Always copy data instead of hardlinking during mutations/replaces/detaches and so on.",\N,\N,0,"Bool",0
"24.3.12.76.altinitystable","disable_freeze_partition_for_zero_copy_replication","1",0,"Disable FREEZE PARTITION query for zero copy replication.",\N,\N,0,"Bool",0
"24.3.12.76.altinitystable","disable_detach_partition_for_zero_copy_replication","1",0,"Disable DETACH PARTITION query for zero copy replication.",\N,\N,0,"Bool",0
"24.3.12.76.altinitystable","disable_fetch_partition_for_zero_copy_replication","1",0,"Disable FETCH PARTITION query for zero copy replication.",\N,\N,0,"Bool",0
"24.3.12.76.altinitystable","part_moves_between_shards_enable","0",0,"Experimental/Incomplete feature to move parts between shards. Does not take into account sharding expressions.",\N,\N,0,"UInt64",0
"24.3.12.76.altinitystable","part_moves_between_shards_delay_seconds","30",0,"Time to wait before/after moving parts between shards.",\N,\N,0,"UInt64",0
"24.3.12.76.altinitystable","allow_remote_fs_zero_copy_replication","0",0,"Don't use this setting in production, because it is not ready.",\N,\N,0,"Bool",0
"24.3.12.76.altinitystable","remote_fs_zero_copy_zookeeper_path","/clickhouse/zero_copy",0,"ZooKeeper path for zero-copy table-independent info.",\N,\N,0,"String",0
"24.3.12.76.altinitystable","remote_fs_zero_copy_path_compatible_mode","0",0,"Run zero-copy in compatible mode during conversion process.",\N,\N,0,"Bool",0
"24.3.12.76.altinitystable","cache_populated_by_fetch","0",0,"Only available in ClickHouse Cloud",\N,\N,0,"Bool",0
"24.3.12.76.altinitystable","force_read_through_cache_for_merges","0",0,"Force read-through filesystem cache for merges",\N,\N,0,"Bool",0
"24.3.12.76.altinitystable","allow_experimental_block_number_column","0",0,"Enable persisting column _block_number for each row.",\N,\N,0,"Bool",0
"24.3.12.76.altinitystable","allow_experimental_replacing_merge_with_cleanup","0",0,"Allow experimental CLEANUP merges for ReplacingMergeTree with is_deleted column.",\N,\N,0,"Bool",0
"24.3.12.76.altinitystable","compress_marks","1",0,"Marks support compression, reduce mark file size and speed up network transmission.",\N,\N,0,"Bool",0
"24.3.12.76.altinitystable","compress_primary_key","1",0,"Primary key support compression, reduce primary key file size and speed up network transmission.",\N,\N,0,"Bool",0
"24.3.12.76.altinitystable","marks_compression_codec","ZSTD(3)",0,"Compression encoding used by marks, marks are small enough and cached, so the default compression is ZSTD(3).",\N,\N,0,"String",0
"24.3.12.76.altinitystable","primary_key_compression_codec","ZSTD(3)",0,"Compression encoding used by primary, primary key is small enough and cached, so the default compression is ZSTD(3).",\N,\N,0,"String",0
"24.3.12.76.altinitystable","marks_compress_block_size","65536",0,"Mark compress block size, the actual size of the block to compress.",\N,\N,0,"UInt64",0
"24.3.12.76.altinitystable","primary_key_compress_block_size","65536",0,"Primary compress block size, the actual size of the block to compress.",\N,\N,0,"UInt64",0
"24.3.12.76.altinitystable","primary_key_lazy_load","1",0,"Load primary key in memory on first use instead of on table initialization. This can save memory in the presence of a large number of tables.",\N,\N,0,"Bool",0
"24.3.12.76.altinitystable","primary_key_ratio_of_unique_prefix_values_to_skip_suffix_columns","0.9",0,"If the value of a column of the primary key in data part changes at least in this ratio of times, skip loading next columns in memory. This allows to save memory usage by not loading useless columns of the primary key.",\N,\N,0,"Float",0
"24.3.12.76.altinitystable","max_projections","25",0,"The maximum number of merge tree projections.",\N,\N,0,"UInt64",0
"24.3.12.76.altinitystable","min_relative_delay_to_yield_leadership","120",0,"Obsolete setting, does nothing.",\N,\N,0,"UInt64",1
"24.3.12.76.altinitystable","check_delay_period","60",0,"Obsolete setting, does nothing.",\N,\N,0,"UInt64",1
"24.3.12.76.altinitystable","replicated_max_parallel_sends","0",0,"Obsolete setting, does nothing.",\N,\N,0,"UInt64",1
"24.3.12.76.altinitystable","replicated_max_parallel_sends_for_table","0",0,"Obsolete setting, does nothing.",\N,\N,0,"UInt64",1
"24.3.12.76.altinitystable","replicated_max_parallel_fetches","0",0,"Obsolete setting, does nothing.",\N,\N,0,"UInt64",1
"24.3.12.76.altinitystable","replicated_max_parallel_fetches_for_table","0",0,"Obsolete setting, does nothing.",\N,\N,0,"UInt64",1
"24.3.12.76.altinitystable","write_final_mark","1",0,"Obsolete setting, does nothing.",\N,\N,0,"Bool",1
"24.3.12.76.altinitystable","min_bytes_for_compact_part","0",0,"Obsolete setting, does nothing.",\N,\N,0,"UInt64",1
"24.3.12.76.altinitystable","min_rows_for_compact_part","0",0,"Obsolete setting, does nothing.",\N,\N,0,"UInt64",1
"24.3.12.76.altinitystable","in_memory_parts_enable_wal","1",0,"Obsolete setting, does nothing.",\N,\N,0,"Bool",1
"24.3.12.76.altinitystable","write_ahead_log_max_bytes","1073741824",0,"Obsolete setting, does nothing.",\N,\N,0,"UInt64",1
"24.3.12.76.altinitystable","write_ahead_log_bytes_to_fsync","104857600",0,"Obsolete setting, does nothing.",\N,\N,0,"UInt64",1
"24.3.12.76.altinitystable","write_ahead_log_interval_ms_to_fsync","100",0,"Obsolete setting, does nothing.",\N,\N,0,"UInt64",1
"24.3.12.76.altinitystable","in_memory_parts_insert_sync","0",0,"Obsolete setting, does nothing.",\N,\N,0,"Bool",1
"24.3.12.76.altinitystable","max_part_loading_threads","'auto(12)'",0,"Obsolete setting, does nothing.",\N,\N,0,"MaxThreads",1
"24.3.12.76.altinitystable","max_part_removal_threads","'auto(12)'",0,"Obsolete setting, does nothing.",\N,\N,0,"MaxThreads",1
"24.3.12.76.altinitystable","use_metadata_cache","0",0,"Obsolete setting, does nothing.",\N,\N,0,"Bool",1
"24.3.12.76.altinitystable","merge_tree_enable_clear_old_broken_detached","0",0,"Obsolete setting, does nothing.",\N,\N,0,"UInt64",1
"24.3.12.76.altinitystable","merge_tree_clear_old_broken_detached_parts_ttl_timeout_seconds","2592000",0,"Obsolete setting, does nothing.",\N,\N,0,"UInt64",1
"24.3.12.76.altinitystable","replicated_fetches_http_connection_timeout","0",0,"Obsolete setting, does nothing.",\N,\N,0,"Seconds",1
"24.3.12.76.altinitystable","replicated_fetches_http_send_timeout","0",0,"Obsolete setting, does nothing.",\N,\N,0,"Seconds",1
"24.3.12.76.altinitystable","replicated_fetches_http_receive_timeout","0",0,"Obsolete setting, does nothing.",\N,\N,0,"Seconds",1
"24.3.12.76.altinitystable","replicated_max_parallel_fetches_for_host","15",0,"Obsolete setting, does nothing.",\N,\N,0,"UInt64",1
"24.3.12.76.altinitystable","clean_deleted_rows","Never",0,"Obsolete setting, does nothing.",\N,\N,0,"CleanDeletedRows",1
